{
 "format": "guided-lesson/0.4",
 "figures": [
  {
   "id": "fig-01",
   "url": "https://raw.githubusercontent.com/SyllabAI/syllabai-resources/main/SME-RevisionNotes/igcse-chemistry-19/assets/d36c1937612f-oxidation-and-reduction-electrons.png",
   "alt": "oxidation-and-reduction-electrons",
   "sourceHeading": "The redox reaction between Fe and Cu<sup>2+</sup>",
   "caption": "The Fe atom is oxidised (loses electrons) and the Cu***<sup>***2+***</sup>*** ion is reduced (gains electrons). Cu***<sup>***2+ ***</sup>***is the oxidising agent",
   "binding": "note-level",
   "moduleIds": []
  },
  {
   "id": "fig-02",
   "url": "https://raw.githubusercontent.com/SyllabAI/syllabai-resources/main/SME-RevisionNotes/igcse-chemistry-19/assets/d4df00a71f5e-oilrig.png",
   "alt": "OILRIG, downloadable AS & A Level Biology revision notes",
   "sourceHeading": "The redox reaction between Fe and Cu<sup>2+</sup>",
   "caption": "'OIL RIG' is a useful mnemonic to help remember the definitions of oxidation and reduction",
   "binding": "note-level",
   "moduleIds": []
  }
 ],
 "noteRef": {
  "noteId": "rn_sX8yyBxHn8bS7t46",
  "corpusVersion": "sme-revision-notes-igcse-chemistry-19-2026-09-18",
  "topicTitle": "2. Inorganic Chemistry",
  "subtopicTitle": "Reactivity Series",
  "sourceUrl": "https://www.savemyexams.com/igcse/chemistry/edexcel/19/revision-notes/2-inorganic-chemistry/2-4-reactivity-series/2-4-5-oxidation-and-reduction"
 },
 "specPoints": [
  {
   "code": "4CH1-2.20",
   "text": "understand the terms: oxidation; reduction; redox; oxidising agent"
  }
 ],
 "primer": {
  "text": "From Reactivity Series you already know that metals can be ranked by how readily they react, and that iron rusts by combining with oxygen. This note names the two halves of that kind of change: oxidation and reduction. It then shows the same reactions through electron transfer, using ionic and half equations.",
  "prerequisiteSubtopic": "Reactivity Series"
 },
 "lessons": [
  {
   "title": "Oxidation & reduction in terms of oxygen",
   "sourceHeadings": [
    "Oxidation & reduction in terms of oxygen",
    "Oxidising agents in terms of electrons"
   ],
   "specRefs": [
    "4CH1-2.20"
   ],
   "opening": "When metals react with oxygen, the change can be given a name: oxidation covers any reaction in which a substance gains oxygen, and reduction is the reverse, in which oxygen is lost. In the displacement of copper from copper(II) oxide by zinc, zinc takes the oxygen, so the oxide is reduced while zinc is oxidised. Because one change cannot happen without the other, the pair is called a redox reaction.",
   "keyPoints": [
    "Oxidation covers every reaction in which a substance gains oxygen.",
    "Reduction is the opposite change, in which a substance loses oxygen.",
    "Oxidation and reduction always occur together, so the overall change is called a redox reaction.",
    "Copper(II) oxide is the oxidising agent because it supplies the oxygen for the change.",
    "Zinc acts as the reducing agent, removing that oxygen from copper(II) oxide."
   ],
   "confidenceGate": {
    "ratings": [
     "low",
     "medium",
     "high"
    ],
    "continueDisabledUntilChoice": true,
    "resumeWithoutReRate": true,
    "postCheckRecalibration": true
   },
   "depthLayers": {
    "low": {
     "restatement": "Oxidation means gaining oxygen and reduction means losing it; the two changes always happen together in a redox reaction. The substance giving oxygen away is the oxidising agent and the one taking it is the reducing agent.",
     "analogy": "Think of a relay race with one baton called oxygen: one runner must hand it over while another takes it, so both events happen as one.",
     "examPointer": "Define oxidation and reduction in one line each, then name the oxidising and reducing agents for whatever equation the question gives."
    },
    "medium": {
     "restatement": "In oxygen language, a species is oxidised when it gains oxygen and reduced when it loses it. In zinc plus copper(II) oxide, the oxide hands oxygen to zinc, so zinc is oxidised, the oxide is reduced, and copper metal is left behind.",
     "analogy": "A tug-of-war rope with a single knot standing for the oxygen: the knot slides from one team to the other, so one side only loses grip as the other gains it.",
     "examPointer": "Two-mark answers usually pair the changes: state which species gains oxygen and which loses it, then label the oxidising and reducing agents."
    }
   },
   "check": [
    {
     "stem": "Which statement gives the correct meaning of oxidation in terms of oxygen?",
     "misconceptionClass": "oxygen-direction error",
     "options": [
      {
       "key": "A",
       "text": "A reaction in which a substance gains oxygen",
       "correct": true,
       "explanation": "Gaining oxygen is the definition of oxidation, as in iron rusting or zinc taking oxygen from copper(II) oxide.",
       "misconception": null
      },
      {
       "key": "B",
       "text": "A reaction in which a substance loses oxygen",
       "correct": false,
       "explanation": "Losing oxygen is reduction, the exact opposite of the change described here.",
       "misconception": "oxidation and reduction reversed"
      },
      {
       "key": "C",
       "text": "Any reaction that produces a metal oxide as a product",
       "correct": false,
       "explanation": "The product alone does not decide the label; oxidation is judged by whether a substance gains oxygen during the reaction.",
       "misconception": "product identity mistaken for the definition"
      },
      {
       "key": "D",
       "text": "Any reaction that needs to be heated before it starts",
       "correct": false,
       "explanation": "Heating is a common way of supplying activation energy and says nothing about whether oxygen is gained or lost.",
       "misconception": "reaction conditions confused with the redox definition"
      }
     ]
    },
    {
     "stem": "In the reaction zinc + copper(II) oxide, which substance is reduced?",
     "misconceptionClass": "species-identification error",
     "options": [
      {
       "key": "A",
       "text": "Copper(II) oxide, because it loses its oxygen",
       "correct": true,
       "explanation": "The oxide hands its oxygen over to zinc, and losing oxygen is reduction by definition.",
       "misconception": null
      },
      {
       "key": "B",
       "text": "Zinc, because it becomes zinc oxide",
       "correct": false,
       "explanation": "Zinc oxide forms because zinc has gained oxygen, and gaining oxygen is oxidation, not reduction.",
       "misconception": "product naming used instead of oxygen transfer"
      },
      {
       "key": "C",
       "text": "Copper, because it ends up as the free metal",
       "correct": false,
       "explanation": "Copper is the product of the reduction, but the substance being reduced is the copper(II) oxide that supplied the oxygen.",
       "misconception": "product of the change mistaken for the species changing"
      },
      {
       "key": "D",
       "text": "Neither substance, because oxygen is only moved around",
       "correct": false,
       "explanation": "Moving oxygen from one substance to another is exactly what makes one substance reduced and the other oxidised.",
       "misconception": "oxygen transfer not recognised as redox"
      }
     ]
    },
    {
     "stem": "Which species is the oxidising agent in Zn + CuO, ZnO + Cu?",
     "misconceptionClass": "agent-identification error",
     "options": [
      {
       "key": "A",
       "text": "CuO, because it supplies the oxygen",
       "correct": true,
       "explanation": "The oxidising agent gives oxygen to the other substance and is itself reduced in the process.",
       "misconception": null
      },
      {
       "key": "B",
       "text": "Zn, because it starts the reaction",
       "correct": false,
       "explanation": "Zinc takes the oxygen, which makes it the reducing agent rather than the oxidising agent.",
       "misconception": "agent roles swapped"
      },
      {
       "key": "C",
       "text": "ZnO, because it contains oxygen afterwards",
       "correct": false,
       "explanation": "The product zinc oxide is evidence that zinc was oxidised; it plays no agent role in the reaction.",
       "misconception": "product mistaken for an agent"
      },
      {
       "key": "D",
       "text": "Cu, because it is displaced as a metal",
       "correct": false,
       "explanation": "Copper is simply released when the oxide is reduced; it neither gives nor takes the oxygen.",
       "misconception": "displaced product mistaken for the agent"
      }
     ]
    },
    {
     "stem": "Why are oxidation and reduction described as redox when they occur together?",
     "misconceptionClass": "coupling reasoning",
     "options": [
      {
       "key": "A",
       "text": "One substance gains oxygen at the same moment another loses it, so the two changes are inseparable",
       "correct": true,
       "explanation": "Oxidation cannot occur without reduction happening simultaneously, which is why the combined change carries one name.",
       "misconception": null
      },
      {
       "key": "B",
       "text": "Both changes need the same amount of heat to proceed",
       "correct": false,
       "explanation": "Sharing conditions does not link the two changes; it is the simultaneous oxygen transfer that couples them.",
       "misconception": "shared conditions mistaken for the coupling"
      },
      {
       "key": "C",
       "text": "They are two names for exactly the same change",
       "correct": false,
       "explanation": "The changes are opposite in direction; they happen together but each substance undergoes a different half.",
       "misconception": "opposites treated as synonyms"
      },
      {
       "key": "D",
       "text": "Redox only applies when oxygen is completely removed",